{"protocol":"owata.handoff/1","envelope_id":"reviewer-cyc3-req24-e6bfb65e-20260830T1001595998432+0900","kind":"reviewer_result","cycle_id":"cyc_3","request_id":"req_24","from_role":"reviewer","to_role":"program_control","created_at":"2026-08-30T10:01:59.5998432+09:00","body":{"target_sha":"e6bfb65e45c433f3529d2702dccbeaaee255fd54","verdict":"REWORK","findings":[{"finding_id":"F-STATUS-001","severity":"major","summary":"Acceptance mismatch: ACCEPTANCE.md:4 requires STATUS=READY, but STATUS.md:1 contains STATUS=BROKEN. The candidate therefore does not satisfy its stated acceptance contract."}],"evidence_refs":["ACCEPTANCE.md:4","STATUS.md:1","verification: Expected=STATUS=READY; Actual=STATUS=BROKEN; Matches=False"]}}