{"protocol":"owata.handoff/1","envelope_id":"env_8e04e5ddbcd847bb8eecaabf4c903021","kind":"reviewer_result","cycle_id":"cyc_3","request_id":"req_25","from_role":"reviewer","to_role":"program_control","created_at":"2026-08-30T11:35:28.6213078+09:00","body":{"target_sha":"2b55aeea55c959131819d6d040cb782bd04dbfaa","verdict":"REWORK","findings":[{"finding_id":"REV-003-B2-S2-001","severity":"major","summary":"STATUS.md contains STATUS=BROKEN, but ACCEPTANCE.md requires STATUS=READY."}],"evidence_refs":["STATUS.md:1","ACCEPTANCE.md:4"]}}