{"protocol":"owata.handoff/1","envelope_id":"12069dba-f4f1-41b4-9a58-c505741031ec","kind":"reviewer_result","cycle_id":"cyc_3","request_id":"req_55","from_role":"reviewer","to_role":"program_control","created_at":"2026-08-30T10:50:13.1505091+09:00","body":{"target_sha":"5b793d97b327fb096c42b1e12620ba9ef25b1c7a","verdict":"REWORK","findings":[{"finding_id":"REV-001","severity":"high","summary":"The target is the first candidate directly atop base_sha with no authorized findings, but STATUS.md is STATUS=READY. CANARY_TASK.md:5-8 and BUILD_STAGE.md:3-5 require the first BUILD to be STATUS=BROKEN and prohibit skipping that intentional candidate; STATUS=READY is reserved for REWORK with authorized findings (CANARY_TASK.md:12-15)."}],"evidence_refs":["git rev-list --parents -n 1 5b793d97b327fb096c42b1e12620ba9ef25b1c7a -> parent 47496081fe7d84417ba0eec0cfadea85b55e8c5a","Canonical Control Request authorized_finding_ids=[]","CANARY_TASK.md:3-15","BUILD_STAGE.md:3-5","STATUS.md:1"]}}