{"protocol":"owata.handoff/1","envelope_id":"reviewer_00f91942-ff48-4bcf-a74a-47138218d67b","kind":"reviewer_result","cycle_id":"cyc_3","request_id":"req_25","from_role":"reviewer","to_role":"program_control","created_at":"2026-08-30T01:47:38.6375907Z","body":{"target_sha":"f8d6bfbf18ff9a3ac6e7bcea50f29bfa86431c88","verdict":"REWORK","findings":[{"finding_id":"F-001","severity":"major","summary":"STATUS.md contains STATUS=BROKEN, which does not match the required STATUS=READY value in ACCEPTANCE.md."}],"evidence_refs":["ACCEPTANCE.md:3-6","STATUS.md:1"]}}