{"protocol":"owata.handoff/1","envelope_id":"d318e18c-7f5d-45e0-8ba3-688a126a34fe","kind":"reviewer_result","cycle_id":"cyc_3","request_id":"req_24","from_role":"reviewer","to_role":"program_control","created_at":"2026-08-30T09:31:43.726+09:00","body":{"target_sha":"6551e7cba907e5db64bbc7ccaf03060be717c038","verdict":"REWORK","findings":[{"finding_id":"REV-001","severity":"HIGH","summary":"The acceptance contract requires STATUS=READY, but STATUS.md contains STATUS=BROKEN."}],"evidence_refs":["ACCEPTANCE.md:3","ACCEPTANCE.md:4","ACCEPTANCE.md:6","STATUS.md:1"]}}