{"protocol":"owata.handoff/1","envelope_id":"env_review_cyc_3_req_24_2dc58d9_20260830T1016595000900","kind":"reviewer_result","cycle_id":"cyc_3","request_id":"req_24","from_role":"reviewer","to_role":"program_control","created_at":"2026-08-30T10:16:59.500+09:00","body":{"target_sha":"2dc58d975a46188ff4047a0d2e5526b58a3f211c","verdict":"REWORK","findings":[{"finding_id":"F-STATUS-001","severity":"major","summary":"STATUS.md does not satisfy the repository acceptance contract: ACCEPTANCE.md requires STATUS=READY, but STATUS.md contains STATUS=BROKEN."}],"evidence_refs":["ACCEPTANCE.md:3","ACCEPTANCE.md:4","ACCEPTANCE.md:6","STATUS.md:1"]}}