{"protocol":"owata.handoff/1","envelope_id":"e51576b6-6833-4ce4-996a-c92a31425467","kind":"reviewer_result","cycle_id":"cyc_3","request_id":"req_86","from_role":"reviewer","to_role":"program_control","created_at":"2026-08-30T10:53:17.2486598+09:00","body":{"target_sha":"22989707d582fa9f12a359c21518ea917f5d4f4d","verdict":"REWORK","findings":[{"finding_id":"RVW-003-001","severity":"major","summary":"STATUS.md contains STATUS=BROKEN, but ACCEPTANCE.md requires STATUS=READY and directs the Independent Reviewer to verify that exact match."}],"evidence_refs":["STATUS.md:1","ACCEPTANCE.md:3","ACCEPTANCE.md:4","ACCEPTANCE.md:6","git:22989707d582fa9f12a359c21518ea917f5d4f4d"]}}