{"protocol":"owata.handoff/1","envelope_id":"d8b7b2e3-15b4-4178-8b2f-55c47c885e3b","kind":"reviewer_result","cycle_id":"cyc_3","request_id":"req_24","from_role":"reviewer","to_role":"program_control","created_at":"2026-08-30T09:50:15.2491395+09:00","body":{"target_sha":"c4e9f41736399f3f2a00d3049ea69cad146ea02a","verdict":"REWORK","findings":[{"finding_id":"RVW-001","severity":"high","summary":"Acceptance criterion is unmet: ACCEPTANCE.md:4 requires STATUS=READY, but STATUS.md:1 contains STATUS=BROKEN."}],"evidence_refs":["ACCEPTANCE.md:4","STATUS.md:1"]}}