{"protocol":"owata.handoff/1","envelope_id":"9efd9922-fda2-43e2-9320-205fed114316","kind":"reviewer_result","cycle_id":"cyc_3","request_id":"req_116","from_role":"reviewer","to_role":"program_control","created_at":"2026-08-30T10:56:11.3787728+09:00","body":{"target_sha":"93a5f2f946de12bb6a4a34dc5db9602be89872e6","verdict":"PASS","findings":[],"evidence_refs":["git rev-parse HEAD => 93a5f2f946de12bb6a4a34dc5db9602be89872e6","ACCEPTANCE.md: expected STATUS=READY","STATUS.md: STATUS=READY","git merge-base --is-ancestor 47496081fe7d84417ba0eec0cfadea85b55e8c5a 93a5f2f946de12bb6a4a34dc5db9602be89872e6 => exit 0","git show 22989707d582fa9f12a359c21518ea917f5d4f4d:STATUS.md => STATUS=BROKEN","git diff-tree 22989707d582fa9f12a359c21518ea917f5d4f4d 93a5f2f946de12bb6a4a34dc5db9602be89872e6 => only STATUS.md modified"]}}