{"protocol":"owata.handoff/1","envelope_id":"813ad5f6-f1d6-4ebd-9c17-ec38ee2b4f1f","kind":"reviewer_result","cycle_id":"cyc_3","request_id":"req_55","from_role":"reviewer","to_role":"program_control","created_at":"2026-08-30T02:38:32.1334738Z","body":{"target_sha":"c800068cb144c2c8eb824a9a6e405e7526702247","verdict":"PASS","findings":[],"evidence_refs":["git rev-parse HEAD => c800068cb144c2c8eb824a9a6e405e7526702247","ACCEPTANCE.md requires STATUS=READY and STATUS.md to match","STATUS.md:1 => STATUS=READY; exactly one content line","Target commit changes the first candidate's STATUS=BROKEN to STATUS=READY, satisfying BUILD_STAGE.md REWORK contract","git diff --check 701ed38c8f1a23b906401bd7919e39c41a26935a..c800068cb144c2c8eb824a9a6e405e7526702247 => clean","git status --short => clean"]}}